{
  "console_messages": [
    {
      "level": "log",
      "text": "export clicked once"
    },
    {
      "level": "log",
      "text": "no errors in console"
    }
  ],
  "dom_excerpts": [
    {
      "html_snippet": "<button type=\"button\" data-testid=\"export\">Export</button>",
      "label": "Export primary CTA",
      "selector": "button[data-testid='export']",
      "visible_text": "Export"
    },
    {
      "label": "Settings heading",
      "selector": "main h1",
      "visible_text": "Settings"
    }
  ],
  "extensions": {
    "fixture_profile": "export_flow.v1",
    "structured_capture_version": 1
  },
  "id": "evidence.export_flow.v1",
  "navigation_sequence": [
    {
      "action": "navigate",
      "title": "Home",
      "url": "https://example.test/"
    },
    {
      "action": "navigate",
      "title": "Settings",
      "url": "https://example.test/settings"
    },
    {
      "action": "click",
      "title": "Export",
      "url": "https://example.test/settings/export"
    }
  ],
  "notes": "Deterministic fixture (no PII). Matches benchmark case.browser.evidence narrative.",
  "schema_version": 1,
  "screenshots": [
    {
      "caption": "Fixture: metadata only (SHA-256 of empty buffer as placeholder).",
      "captured_at": "1970-01-01T00:00:00Z",
      "content_sha256": "e3b0c44298fc1c149afbf4c8996fb92427ae41e4649b934ca495991b7852b855",
      "mime_type": "image/png",
      "viewport_height": 720,
      "viewport_width": 1280
    }
  ],
  "title": "Abstract trace: Home \u2192 Settings \u2192 Export"
}
