{
  "schema_version": 1,
  "id": "evidence.export_flow.v1",
  "title": "Abstract trace: Home → Settings → Export",
  "navigation_sequence": [
    {
      "url": "https://example.test/",
      "title": "Home",
      "action": "navigate"
    },
    {
      "url": "https://example.test/settings",
      "title": "Settings",
      "action": "navigate"
    },
    {
      "url": "https://example.test/settings/export",
      "title": "Export",
      "action": "click"
    }
  ],
  "console_messages": [
    { "level": "log", "text": "export clicked once" },
    { "level": "log", "text": "no errors in console" }
  ],
  "dom_excerpts": [
    {
      "label": "Export primary CTA",
      "selector": "button[data-testid='export']",
      "visible_text": "Export",
      "html_snippet": "<button type=\"button\" data-testid=\"export\">Export</button>"
    },
    {
      "label": "Settings heading",
      "selector": "main h1",
      "visible_text": "Settings"
    }
  ],
  "screenshots": [
    {
      "content_sha256": "e3b0c44298fc1c149afbf4c8996fb92427ae41e4649b934ca495991b7852b855",
      "viewport_width": 1280,
      "viewport_height": 720,
      "mime_type": "image/png",
      "caption": "Fixture: metadata only (SHA-256 of empty buffer as placeholder).",
      "captured_at": "1970-01-01T00:00:00Z"
    }
  ],
  "extensions": {
    "fixture_profile": "export_flow.v1",
    "structured_capture_version": 1
  },
  "notes": "Deterministic fixture (no PII). Matches benchmark case.browser.evidence narrative."
}
